{
  "$schema": "https://json-schema.org/draft/2020-12/schema",
  "title": "dsh-claude-style design tokens",
  "description": "The skin's custom properties: the build generates the token stylesheet and the docs/STYLE.md tables from this document (D9, D30).",
  "type": "object",
  "required": ["typeface", "apex", "palette", "motion", "layer"],
  "additionalProperties": false,
  "properties": {
    "$schema": { "type": "string" },
    "typeface": {
      "description": "Font tokens: `claude` under the Claude typeface, `host` under the host's.",
      "type": "array",
      "items": {
        "type": "object",
        "required": ["token"],
        "anyOf": [{ "required": ["claude"] }, { "required": ["host"] }],
        "additionalProperties": false,
        "properties": {
          "token": { "$ref": "#/$defs/token" },
          "claude": { "$ref": "#/$defs/value" },
          "host": { "$ref": "#/$defs/value" },
          "note": { "$ref": "#/$defs/note" }
        }
      }
    },
    "apex": {
      "description": "The reasoning slider's accent colours — its matrix and knob glow, and the trigger's ramp — mixed from the accent of the palette in force.",
      "type": "array",
      "items": {
        "type": "object",
        "required": ["token", "dark", "light"],
        "additionalProperties": false,
        "properties": {
          "token": { "$ref": "#/$defs/token" },
          "dark": { "$ref": "#/$defs/value" },
          "light": { "$ref": "#/$defs/value" },
          "note": { "$ref": "#/$defs/note" }
        }
      }
    },
    "palette": {
      "description": "The colour cards, the tone ladder every colour token is a step of, and the tokens themselves.",
      "type": "object",
      "required": ["cards", "tones", "tokens"],
      "additionalProperties": false,
      "properties": {
        "cards": {
          "description": "The looks a reader can pick; the first card is the default.",
          "type": "array",
          "minItems": 1,
          "items": {
            "type": "object",
            "required": ["id", "accent", "canvas", "edges", "logoInk", "code"],
            "additionalProperties": false,
            "properties": {
              "id": { "type": "string", "pattern": "^[a-z][a-z0-9-]*$" },
              "accent": { "$ref": "#/$defs/value" },
              "canvas": { "$ref": "#/$defs/themes" },
              "sidebar": { "$ref": "#/$defs/themes" },
              "bubble": { "$ref": "#/$defs/themes" },
              "link": { "$ref": "#/$defs/themes" },
              "edges": { "description": "How a dark canvas draws its outlines: a lit highlight or a flat surface step.", "enum": ["highlight", "surface"] },
              "logoInk": { "description": "What the sidebar's brand art is drawn in before the reader's own image-colour choice.", "enum": ["ink", "accent"] },
              "code": { "$ref": "#/$defs/themes" }
            }
          }
        },
        "tones": {
          "description": "The ladder: every colour token is one step of a seed's own hue.",
          "type": "array",
          "minItems": 1,
          "items": {
            "type": "object",
            "required": ["id"],
            "anyOf": [{ "required": ["light"] }, { "required": ["dark"] }],
            "additionalProperties": false,
            "properties": {
              "id": { "type": "string", "pattern": "^[a-z][a-z0-9-]*$" },
              "light": { "$ref": "#/$defs/tone" },
              "dark": { "$ref": "#/$defs/tone" },
              "note": { "$ref": "#/$defs/note" }
            }
          }
        },
        "tokens": {
          "description": "Every colour token: the tone it paints, a literal, an alias, or the card's own trait.",
          "type": "array",
          "minItems": 1,
          "items": {
            "type": "object",
            "required": ["token"],
            "anyOf": [{ "required": ["tone"] }, { "required": ["literal"] }, { "required": ["alias"] }, { "required": ["card"] }],
            "additionalProperties": false,
            "properties": {
              "token": { "$ref": "#/$defs/token" },
              "tone": { "type": "string", "pattern": "^[a-z][a-z0-9-]*$" },
              "flat": { "description": "The rung a card with flat contours reads instead, in the scheme the tone names.", "type": "string", "pattern": "^[a-z][a-z0-9-]*$" },
              "literal": { "$ref": "#/$defs/themes" },
              "alias": { "$ref": "#/$defs/token" },
              "card": { "enum": ["logoInk", "code", "sidebar", "bubble"] },
              "schemes": { "description": "The schemes this token paints; every scheme when absent.", "type": "array", "minItems": 1, "uniqueItems": true, "items": { "enum": ["light", "dark"] } },
              "host": { "$ref": "#/$defs/value" },
              "use": { "description": "What the token paints, for the docs/STYLE.md table.", "type": "string", "minLength": 1 },
              "note": { "$ref": "#/$defs/note" }
            }
          }
        }
      }
    },
    "motion": {
      "description": "Motion tokens (D9): durations, loop periods, easing curves, distances, blur and scale, and the two duration-and-curve shorthands. One value under every card and typeface; the only place a stylesheet may write a time or a curve.",
      "type": "array",
      "items": {
        "type": "object",
        "required": ["token", "value", "use"],
        "additionalProperties": false,
        "properties": {
          "token": { "type": "string", "pattern": "^--dsh-claude-(duration|period|ease|distance|blur|scale|timing)-[a-z0-9-]+$" },
          "value": { "$ref": "#/$defs/value" },
          "use": { "description": "The role the token plays, for the docs/STYLE.md motion table.", "type": "string", "minLength": 1 },
          "note": { "$ref": "#/$defs/note" }
        }
      }
    },
    "layer": {
      "description": "Layer tokens (D9): the stacking levels a skin surface takes against what the host draws around it. One value under every card and typeface; the only place a stylesheet may write a z-index above the local orders 0 to 9.",
      "type": "array",
      "items": {
        "type": "object",
        "required": ["token", "value", "use"],
        "additionalProperties": false,
        "properties": {
          "token": { "type": "string", "pattern": "^--dsh-claude-layer-[a-z0-9-]+$" },
          "value": { "type": "string", "pattern": "^[1-9][0-9]+$" },
          "use": { "description": "What stands on this level and what it has to clear, for the docs/STYLE.md layer table.", "type": "string", "minLength": 1 },
          "note": { "$ref": "#/$defs/note" }
        }
      }
    }
  },
  "$defs": {
    "token": { "type": "string", "pattern": "^--(dsw|dsh-claude)-[a-z0-9-]+$" },
    "value": { "type": "string", "minLength": 1, "pattern": "^[^;{}]+$" },
    "note": { "description": "Why the value has this shape; kept for maintainers, not emitted.", "type": "string", "minLength": 1 },
    "themes": {
      "type": "object",
      "minProperties": 1,
      "additionalProperties": false,
      "properties": {
        "dark": { "$ref": "#/$defs/value" },
        "light": { "$ref": "#/$defs/value" }
      }
    },
    "tone": {
      "description": "One step of a seed: the seed it reads, a lightness offset, a chroma offset or multiple, a hue shift and, where the surface is translucent, an alpha.",
      "type": "object",
      "required": ["seed"],
      "additionalProperties": false,
      "properties": {
        "seed": { "description": "A card seed (canvas, accent, link) or a tone declared above this one.", "type": "string", "pattern": "^[a-z][a-z0-9-]*$" },
        "hue": { "description": "A seed whose hue the rung takes instead of its own, for an ink that keeps the canvas's warmth.", "type": "string", "pattern": "^[a-z][a-z0-9-]*$" },
        "dl": { "type": "number", "minimum": -1, "maximum": 1 },
        "l": { "description": "An absolute lightness, for a rung the seed's own lightness cannot place (a tint on both cards).", "type": "number", "minimum": 0, "maximum": 1 },
        "dc": { "description": "Added to the seed's own chroma, so a card keeps its family's saturation.", "type": "number", "minimum": -0.4, "maximum": 0.4 },
        "c": { "description": "An absolute chroma, for a rung that must not follow the card's saturation.", "type": "number", "minimum": 0, "maximum": 0.4 },
        "m": { "description": "Multiplies the seed's own chroma.", "type": "number", "minimum": 0, "maximum": 4 },
        "h": { "type": "number", "minimum": -180, "maximum": 180 },
        "a": { "type": "number", "minimum": 0, "maximum": 1 }
      }
    }
  }
}
