{
  "$schema": "./tokens.schema.json",
  "typeface": [
    {
      "token": "--dsw-font-family",
      "claude": "'Anthropic Sans Web Text','Claude Style Inter','Noto Sans SC','Source Han Sans SC',-apple-system,BlinkMacSystemFont,'Segoe UI','PingFang SC','Hiragino Sans GB','Microsoft YaHei','Helvetica Neue',Helvetica,Arial,sans-serif"
    },
    {
      "token": "--dsh-claude-font-serif",
      "claude": "'Anthropic Serif Web Text','Claude Style Noto Serif',Georgia,'Times New Roman','Noto Sans SC','Source Han Sans SC','PingFang SC','Hiragino Sans GB','Microsoft YaHei',sans-serif",
      "host": "var(--dsw-font-family)"
    },
    {
      "token": "--dsh-claude-font-prose",
      "claude": "'Anthropic Serif Web Text','Claude Style Noto Serif',Georgia,'Times New Roman','Noto Sans SC','Source Han Sans SC','PingFang SC','Hiragino Sans GB','Microsoft YaHei',sans-serif",
      "host": "var(--dsw-font-family)",
      "note": "Conversation prose: Claude sets Latin text in the serif face and lets Chinese fall through to a sans CJK — the serif Latin faces carry no CJK glyphs, so the stack leads with serif and names the sans CJK families after it. The interface keeps the sans stack; only Markdown prose uses this."
    },
    {
      "token": "--dsh-claude-font-code",
      "claude": "'Anthropic Mono Web','JetBrains Mono','Noto Sans SC','Source Han Sans SC','PingFang SC','Hiragino Sans GB','Microsoft YaHei',ui-monospace,'SF Mono','Fira Code',Consolas,'Liberation Mono',Menlo,Courier,monospace",
      "host": "var(--ds-font-family-code)"
    },
    {
      "token": "--dsh-claude-font-brand",
      "claude": "'Anthropic Serif Web Text', var(--dsh-claude-font-serif)",
      "host": "var(--dsw-font-family)",
      "note": "Claude's lockup is drawn in Anthropic's serif, so its rows take the same face; the serif token stays behind it so a missing font degrades to the shipped serif."
    },
    {
      "token": "--dsw-font-markdown-h2",
      "claude": "700 calc(18px + var(--dsh-content-font-delta)) / calc(26px + var(--dsh-content-font-delta)) var(--dsh-claude-font-prose)",
      "note": "The host reads these through a `font:` shorthand that names --dsw-font-family directly, so overriding the `-font-family` sub-tokens never reached the page: the shorthand itself has to be re-declared."
    },
    {
      "token": "--dsw-font-markdown-h3",
      "claude": "700 calc(16px + var(--dsh-content-font-delta)) / calc(24px + var(--dsh-content-font-delta)) var(--dsh-claude-font-prose)"
    }
  ],
  "apex": [
    {
      "token": "--dsh-claude-apex",
      "dark": "color-mix(in oklch, var(--dsw-alias-brand-primary) 82%, var(--dsw-alias-label-primary))",
      "light": "color-mix(in oklch, var(--dsw-alias-brand-primary) 82%, var(--dsw-alias-label-primary))"
    },
    {
      "token": "--dsh-claude-apex-flash",
      "dark": "color-mix(in srgb, var(--dsw-alias-brand-primary) 52%, var(--dsw-static-neutral-bluish-00, #ffffff))",
      "light": "color-mix(in srgb, var(--dsw-alias-brand-primary) 52%, var(--dsw-static-neutral-bluish-00, #ffffff))"
    },
    {
      "token": "--dsh-claude-effort-low",
      "dark": "color-mix(in oklch, var(--dsw-alias-brand-primary) 68%, var(--dsw-alias-bg-layer-3))",
      "light": "color-mix(in oklch, var(--dsw-alias-brand-primary) 68%, var(--dsw-alias-bg-layer-3))",
      "note": "The effort ramp takes the theme's accent hue: its weak end mixes that accent toward the raised surface, lowering the saturation and the contrast while the hue stays the reader's choice. The strongest end in --dsh-claude-effort-high mixes the same accent toward the label ink on each appearance."
    },
    {
      "token": "--dsh-claude-effort-high",
      "dark": "color-mix(in oklch, var(--dsw-alias-brand-primary) 82%, var(--dsw-alias-label-primary))",
      "light": "color-mix(in oklch, var(--dsw-alias-brand-primary) 82%, var(--dsw-alias-label-primary))",
      "note": "The effort ramp's strong end: the theme accent deepened toward the label ink, so the rung order reads through lightness and saturation without leaving the theme's hue."
    }
  ],
  "palette": {
    "cards": [
      {
        "id": "claude",
        "accent": "#d97757",
        "canvas": {
          "light": "#ffffff",
          "dark": "#191919"
        },
        "sidebar": {
          "light": "#fafafa",
          "dark": "#1f1f1f"
        },
        "bubble": {
          "light": "#f4f2f3",
          "dark": "rgba(255, 255, 255, 0.06)"
        },
        "link": {
          "light": "#184f95",
          "dark": "#8ab4f8"
        },
        "edges": "highlight",
        "logoInk": "ink",
        "code": {
          "light": "#943333",
          "dark": "#e8a08a"
        }
      },
      {
        "id": "deepseek",
        "accent": "#4d6bfe",
        "canvas": {
          "light": "#fbfcff",
          "dark": "#13161d"
        },
        "sidebar": {
          "light": "#f7f9ff",
          "dark": "#13161d"
        },
        "bubble": {
          "light": "#ecf0ff",
          "dark": "#262b36"
        },
        "link": {
          "light": "#3b56d9",
          "dark": "#8fa4ff"
        },
        "edges": "surface",
        "logoInk": "accent",
        "code": {
          "light": "#0f1115",
          "dark": "#eef1f8"
        }
      }
    ],
    "tones": [
      {
        "id": "canvas",
        "light": {
          "seed": "canvas",
          "dl": 0
        },
        "dark": {
          "seed": "canvas",
          "dl": 0
        }
      },
      {
        "id": "surface-1",
        "light": {
          "seed": "canvas",
          "dl": 0
        },
        "dark": {
          "seed": "canvas",
          "dl": 0.036
        }
      },
      {
        "id": "surface-2",
        "light": {
          "seed": "canvas",
          "dl": 0
        },
        "dark": {
          "seed": "canvas",
          "dl": 0.065
        }
      },
      {
        "id": "surface-3",
        "light": {
          "seed": "canvas",
          "dl": 0.002
        },
        "dark": {
          "seed": "canvas",
          "dl": 0.104
        }
      },
      {
        "id": "overlay",
        "light": {
          "seed": "canvas",
          "dl": 0.01,
          "c": 0
        },
        "dark": {
          "seed": "canvas",
          "dl": 0.065
        }
      },
      {
        "id": "code-block",
        "light": {
          "seed": "canvas",
          "dl": 0.01,
          "c": 0
        },
        "dark": {
          "seed": "canvas",
          "dl": 0.036
        }
      },
      {
        "id": "inset",
        "light": {
          "seed": "canvas",
          "dl": 0.01,
          "c": 0
        },
        "dark": {
          "seed": "canvas",
          "dl": -0.024
        }
      },
      {
        "id": "card",
        "light": {
          "seed": "canvas",
          "dl": 0
        },
        "dark": {
          "seed": "canvas",
          "dl": 0.044
        }
      },
      {
        "id": "table-head",
        "light": {
          "seed": "canvas",
          "dl": -0.034
        },
        "dark": {
          "seed": "canvas",
          "dl": 0.065
        }
      },
      {
        "id": "hover-plate",
        "light": {
          "seed": "canvas",
          "dl": -0.034
        },
        "dark": {
          "seed": "canvas",
          "dl": 0.104
        }
      },
      {
        "id": "selector",
        "light": {
          "seed": "canvas",
          "dl": -0.004
        },
        "dark": {
          "seed": "canvas",
          "dl": 0.104
        }
      },
      {
        "id": "chip",
        "light": {
          "seed": "canvas",
          "dl": -0.019
        },
        "dark": {
          "seed": "canvas",
          "dl": 0
        }
      },
      {
        "id": "sidebar",
        "light": {
          "seed": "canvas",
          "dl": -0.002,
          "dc": 0.002
        },
        "dark": {
          "seed": "canvas",
          "dl": 0
        }
      },
      {
        "id": "ink",
        "light": {
          "seed": "canvas",
          "hue": "canvas",
          "dl": -0.801
        },
        "dark": {
          "seed": "canvas",
          "hue": "canvas",
          "dl": 0.781
        }
      },
      {
        "id": "ink-2",
        "light": {
          "seed": "canvas",
          "hue": "canvas",
          "dl": -0.474,
          "dc": 0.01
        },
        "dark": {
          "seed": "canvas",
          "hue": "canvas",
          "dl": 0.571,
          "dc": 0.009
        }
      },
      {
        "id": "ink-3",
        "light": {
          "seed": "canvas",
          "hue": "canvas",
          "dl": -0.365,
          "dc": 0.011
        },
        "dark": {
          "seed": "canvas",
          "hue": "canvas",
          "dl": 0.458,
          "dc": 0.012
        }
      },
      {
        "id": "ink-4",
        "light": {
          "seed": "canvas",
          "hue": "canvas",
          "dl": -0.251,
          "dc": 0.007
        },
        "dark": {
          "seed": "canvas",
          "hue": "canvas",
          "dl": 0.336,
          "dc": 0.01
        }
      },
      {
        "id": "bubble",
        "light": {
          "seed": "canvas",
          "dl": -0.037,
          "dc": 0.002
        },
        "dark": {
          "seed": "ink",
          "dl": 0.09,
          "a": 0.06
        }
      },
      {
        "id": "bubble-flat",
        "dark": {
          "seed": "canvas",
          "dl": 0.088,
          "dc": 0.006
        }
      },
      {
        "id": "border-1",
        "light": {
          "seed": "canvas",
          "hue": "canvas",
          "dl": -0.067
        },
        "dark": {
          "seed": "ink",
          "hue": "ink",
          "dl": 0.026,
          "a": 0.09
        }
      },
      {
        "id": "border-2",
        "light": {
          "seed": "canvas",
          "hue": "canvas",
          "dl": -0.098
        },
        "dark": {
          "seed": "ink",
          "hue": "ink",